{
  "version": "1.0.0",
  "generated_at": "2026-10-22T18:23:16.583009Z",
  "total_targets": 15,
  "targets": [
    {
      "target_id": "TGT-001",
      "company_name": "Apex Architectural Roofing & Copperworks",
      "vertical": "Luxury Residential Roofing & Architectural Standing Seam",
      "headquarters": "Denver, CO",
      "website_url": "https://apexarchitecturalroof.com",
      "domain_url": "https://apexarchitecturalroof.com",
      "estimated_aov": 28500.0,
      "estimated_aov_usd": 28500.0,
      "estimated_monthly_visitors": 3200,
      "monthly_visitors": 3200,
      "estimated_ad_spend_monthly": 6500.0,
      "estimated_monthly_ad_spend_usd": 6500.0,
      "decision_maker": {
        "name": "Garrett Vance",
        "title": "Founder & Managing Partner",
        "email": "garrett@apexarchitecturalroof.com",
        "phone": "(303) 555-0194",
        "linkedin_url": "https://linkedin.com/in/garrett-vance-apex"
      },
      "primary_conversion_leak": "Uncompressed 38.4MB 4K hero video stalling Largest Contentful Paint (LCP) at 6.8 seconds on 4G mobile, bouncing 58% of paid mobile visitors.",
      "secondary_conversion_leak": "Mobile header phone number is an inert string lacking the tel: link attribute, preventing one-tap mobile calling.",
      "estimated_monthly_lost_pipeline": 114000.0,
      "estimated_annual_recoverable": 1368000.0,
      "tailored_pitch_file": "pitches/pitch_tgt_001.md",
      "audit_report_file": "audits/audit_tgt_001.md",
      "diagnostics": {
        "primary_leak_summary": "Uncompressed Hero video (38.4MB MP4) stalling LCP at 6.8s on 4G mobile",
        "primary_leak_technical_detail": "Asset /assets/videos/hero_copper_install.mp4 (38.4MB, no poster fallback) blocks hero render on cellular connections. 58% bounce before CTA.",
        "secondary_leak_summary": "Mobile header phone number is an inert SVG/text element lacking tel:+13035550194 anchor href.",
        "mobile_lcp_seconds": 6.8,
        "mobile_cls_score": 0.05,
        "speed_to_lead_sla_hours": 18.0
      },
      "financial_impact": {
        "estimated_monthly_lost_pipeline_usd": 114000.0,
        "estimated_annual_recoverable_usd": 1368000.0
      },
      "outreach_assets": {
        "email_subject": "Quick video on your mobile hero video (losing Denver copper inquiries)",
        "email_body_template": "Hi Garrett, your 38MB hero video delays mobile load to 6.8s, bouncing half your visitors. Fixing this recovers $114k/mo in consultations. I recorded a quick video showing the fix. Open to seeing it? Best, Autonomous Revenue Engine.",
        "video_script_90sec": "0:00-0:15 | Pattern Interrupt: Hi Garrett, looking directly at your Denver architectural roofing landing page on an emulated iPhone on mobile LTE. For the first 6.8 seconds, the screen is entirely blank white while your 38-megabyte 4K drone video downloads in the background.\n0:15-0:45 | Diagnostic & Revenue Loss: With 58% paid mobile traffic from Google Ads, visitors bounce before your consultation button renders. When they scroll, tapping your phone number does not open the dialer because it lacks an active link attribute. At a $28,500 average project value, losing four high-ticket mobile leads a month silently drains over $114,000 in pipeline.\n0:45-1:10 | The Frictionless Fix: The fix takes less than 15 minutes: add a lightweight 42kb WebP poster image so the hero displays under 800ms, defer the video payload, and wrap your header contact in an active tel: link.\n1:10-1:30 | Soft CTA: I recorded a 3-minute video showing your web team how to drop in these two fixes. Would you like me to send that over for your developer?"
      }
    },
    {
      "target_id": "TGT-002",
      "company_name": "Summit Heritage Slate & Tile",
      "vertical": "Historical Restoration & Luxury Slate Roofing",
      "headquarters": "Scarsdale, NY",
      "website_url": "https://summitheritageslate.com",
      "domain_url": "https://summitheritageslate.com",
      "estimated_aov": 42000.0,
      "estimated_aov_usd": 42000.0,
      "estimated_monthly_visitors": 2100,
      "monthly_visitors": 2100,
      "estimated_ad_spend_monthly": 4000.0,
      "estimated_monthly_ad_spend_usd": 4000.0,
      "decision_maker": {
        "name": "Julian Moreau",
        "title": "Director of Operations & Estimating",
        "email": "jmoreau@summitheritageslate.com",
        "phone": "(914) 555-0182",
        "linkedin_url": "https://linkedin.com/in/julian-moreau-slate"
      },
      "primary_conversion_leak": "Absence of sticky mobile conversion banner across 9 full viewports of slate portfolio scrolling.",
      "secondary_conversion_leak": "Multi-step quote form JS error (datePicker.init is not a function) silently breaks submission on iOS Safari.",
      "estimated_monthly_lost_pipeline": 126000.0,
      "estimated_annual_recoverable": 1512000.0,
      "tailored_pitch_file": "pitches/pitch_tgt_002.md",
      "audit_report_file": "audits/audit_tgt_002.md",
      "diagnostics": {
        "primary_leak_summary": "Missing sticky mobile CTA bar across deep portfolio galleries",
        "primary_leak_technical_detail": "Gallery pages require 9 full viewport scrolls without persistent call-to-action bar, dropping mobile scroll-to-action rate to 0.8%.",
        "secondary_leak_summary": "Uncaught TypeError: datePicker.init is not a function in bundle.min.js:142 on iOS Safari.",
        "mobile_lcp_seconds": 4.2,
        "mobile_cls_score": 0.08,
        "speed_to_lead_sla_hours": 22.0
      },
      "financial_impact": {
        "estimated_monthly_lost_pipeline_usd": 126000.0,
        "estimated_annual_recoverable_usd": 1512000.0
      },
      "outreach_assets": {
        "email_subject": "Broken inspection form on iOS (Westchester slate projects)",
        "email_body_template": "Hi Julian, while testing summitheritageslate.com on an iPhone, I found a JavaScript date-picker bug silently blocking Step 3 quote submissions. For $42k slate projects, fixing this protects $126k/mo in pipeline. I wrote a 4-line patch. Open to seeing the code? Best, Autonomous Revenue Engine.",
        "video_script_90sec": "0:00-0:15 | Pattern Interrupt: Hi Julian, I was admiring your historic slate restoration work across Westchester County, but when browsing on an iPhone, there is a severe conversion break on Step 3 of your inspection form.\n0:15-0:45 | Diagnostic & Revenue Loss: Watch what happens when a Scarsdale estate owner fills out your 3-step quote form. When they select roof pitch and tap Submit, nothing happens. A JavaScript date-picker error in bundle.min.js silently blocks the submit event with zero visual feedback. Affluent homeowners assume your site is broken and leave. At a $42,000 average contract value, losing three projects a month costs over $126,000 in pipeline.\n0:45-1:10 | The Frictionless Fix: By replacing obsolete jQuery plugins with native HTML5 date pickers and anchoring a sticky Book Slate Inspection bar along your portfolio galleries, mobile visitors get an instant, reliable path to convert.\n1:10-1:30 | Soft CTA: I documented the exact 4 lines of script code your developer needs to replace to fix this today. Mind if I send over the code snippet?"
      }
    },
    {
      "target_id": "TGT-003",
      "company_name": "Vanguard Metal Roofing Systems",
      "vertical": "Commercial & Luxury Standing Seam Metal Roofing",
      "headquarters": "Austin, TX",
      "website_url": "https://vanguardmetalroofs.com",
      "domain_url": "https://vanguardmetalroofs.com",
      "estimated_aov": 24000.0,
      "estimated_aov_usd": 24000.0,
      "estimated_monthly_visitors": 4500,
      "monthly_visitors": 4500,
      "estimated_ad_spend_monthly": 8000.0,
      "estimated_monthly_ad_spend_usd": 8000.0,
      "decision_maker": {
        "name": "Marcus Sterling",
        "title": "VP of Commercial Development",
        "email": "m.sterling@vanguardmetalroofs.com",
        "phone": "(512) 555-0147",
        "linkedin_url": "https://linkedin.com/in/marcussterling-vanguard"
      },
      "primary_conversion_leak": "Unautomated lead intake routing to an unmonitored inbox with a 19.4-hour SLA delay.",
      "secondary_conversion_leak": "Absence of an interactive instant cost-per-sq-ft estimator causing bounce to regional competitors.",
      "estimated_monthly_lost_pipeline": 144000.0,
      "estimated_annual_recoverable": 1728000.0,
      "tailored_pitch_file": "pitches/pitch_tgt_003.md",
      "audit_report_file": "audits/audit_tgt_003.md",
      "diagnostics": {
        "primary_leak_summary": "19.4-hour lead response delay without automated SMS confirmation",
        "primary_leak_technical_detail": "Inbound RFP forms dump to info@vanguardmetalroofs.com with no webhook trigger. Lead close probability decays by 80% after 15 minutes.",
        "secondary_leak_summary": "Missing instant material/cost-per-square estimator on commercial landing pages.",
        "mobile_lcp_seconds": 3.8,
        "mobile_cls_score": 0.04,
        "speed_to_lead_sla_hours": 19.4
      },
      "financial_impact": {
        "estimated_monthly_lost_pipeline_usd": 144000.0,
        "estimated_annual_recoverable_usd": 1728000.0
      },
      "outreach_assets": {
        "email_subject": "Speed-to-lead audit: Austin commercial metal roofing leads",
        "email_body_template": "Hi Marcus, your commercial metal roofing pages rank well, but a 19-hour response delay costs estimated $144k/mo in pipeline. Responding within 5 minutes via automated SMS doubles bid capture. I diagrammed an instant SMS self-scheduling integration for your team. Open to reviewing? Best, Autonomous Revenue Engine.",